{
  "schema_version": 1,
  "plan_id": "m4-v0.2.1-window-01",
  "project_id": "codex-sol-luna-orchestration-kit",
  "status": "frozen-before-first-start",
  "created_at": "2026-08-02T20:40:40Z",
  "source_commit": "7efec694aa33db0d04964083a8938b62d59ce295",
  "sample_size": 10,
  "deadline_hours": 168,
  "minimum_families": 3,
  "assignment_method": "predeclared-matched-alternating",
  "policies": {
    "all-max-control": {
      "environment_label": "control",
      "bundle_version": "all-max-v1",
      "policy_hash_kind": "bundle-manifest",
      "policy_path": "control-bundles/all-max-v1/manifest.json",
      "policy_sha256": "3e0629316c5a3efab84aec01522d09430067eb95fb3f62486f58abc03584ad3a",
      "agents_path": "control-bundles/all-max-v1/files/AGENTS.md",
      "agents_sha256": "448be1a0db3ca464c21e0317e901bab584f9b8988ce793d41e53129a05d99060",
      "config_path": "config-snippet.toml",
      "config_sha256": "021b9ed7b0ee52eb6c7930497816314694ceff1b1dd0e4d58a1fc86eb61f410c",
      "rate_card_path": "control-bundles/all-max-v1/files/config/rate-card.v1.json",
      "rate_card_sha256": "60114b23a8fc361db5718fc13a644cd50c645a8b945e57d018aecd9ad5765db8",
      "roles": {
        "luna_scout_fast": {
          "path": "control-bundles/all-max-v1/files/agents/luna_scout_fast.toml",
          "sha256": "44e766d4c257277d72fb5c78bfb9b35db632f5d2050247e9252f329699398cac"
        },
        "luna_worker_fast": {
          "path": "control-bundles/all-max-v1/files/agents/luna_worker_fast.toml",
          "sha256": "d31af7e6ef3523607d5a564edadb55af2dce91bff4099408ba323d5e80533d1c"
        },
        "luna_critic_fast": {
          "path": "control-bundles/all-max-v1/files/agents/luna_critic_fast.toml",
          "sha256": "19886017f3618f0edb59129189d6656a1f70b6d5f364bc29b076e1924b600538"
        },
        "luna_tester_fast": {
          "path": "control-bundles/all-max-v1/files/agents/luna_tester_fast.toml",
          "sha256": "49040a42684f59efbcba119275a426ca8cae2efec0235904152b02517cf5c880"
        },
        "luna_max_fast": {
          "path": "control-bundles/all-max-v1/files/agents/luna_max_fast.toml",
          "sha256": "acd61bfb5cb1328edef12e58467ac491fbd9f6141674dff5514fec596d4cf1ef"
        }
      }
    },
    "dynamic-v0.2.1": {
      "environment_label": "dynamic",
      "bundle_version": "dynamic-v0.2.1",
      "policy_hash_kind": "routing-policy",
      "policy_path": "config/routing-policy.v1.json",
      "policy_sha256": "91a616a26ac043ec228260f465dbb7f8f6a5aad6bfd22c946aa8dd8473a7985c",
      "agents_path": "AGENTS.md",
      "agents_sha256": "769910295dc442b19366f8ef7d6a073e4f22c47bdfc76999dcff74ac53ffb23e",
      "config_path": "config-snippet.toml",
      "config_sha256": "021b9ed7b0ee52eb6c7930497816314694ceff1b1dd0e4d58a1fc86eb61f410c",
      "rate_card_path": "config/rate-card.v1.json",
      "rate_card_sha256": "60114b23a8fc361db5718fc13a644cd50c645a8b945e57d018aecd9ad5765db8",
      "roles": {
        "luna_scout_fast": {
          "path": "agents/luna_scout_fast.toml",
          "sha256": "a99fbd1db9636a79b746b1658ef78401f75bb5ed1199577de30092b18de428f2"
        },
        "luna_worker_fast": {
          "path": "agents/luna_worker_fast.toml",
          "sha256": "6fb99368c14031d3af7d3eef73d433bf2cc584eedcdaeb43de648669db765b20"
        },
        "luna_critic_fast": {
          "path": "agents/luna_critic_fast.toml",
          "sha256": "cbc67737e881c40f4f7407fe4d710a01eb25842759a6f05f379f20e6f6f045bd"
        },
        "luna_tester_fast": {
          "path": "agents/luna_tester_fast.toml",
          "sha256": "a99cb7d1ce9cdb93e9bc1c1f372bb2689f611a5f29e0e5d9171f4b0bafff745f"
        },
        "luna_max_fast": {
          "path": "agents/luna_max_fast.toml",
          "sha256": "61679eb82757f7b8a5d4c4726eb1d68d7dc2f704f59e2358aa63b81bb9eb4725"
        }
      }
    }
  },
  "checkpoints": {
    "terminal_coverage_required": 1.0,
    "critical_high_defect_regression_max": 0,
    "spawn_precision_min": 0.8,
    "weighted_usage_reduction_target": 0.2,
    "latency_noninferiority_margin": 0.2,
    "required_dispositions": [
      "accepted",
      "rejected",
      "abandoned"
    ],
    "promotion_requires_calibrated_or_replicated": true,
    "automatic_promotion": false
  },
  "kill_criteria": [
    "critical-or-high-defect-regression",
    "runtime-policy-drift",
    "privacy-or-security-failure",
    "receipt-or-attribution-integrity-failure"
  ],
  "slots": [
    {
      "slot_id": "m4-01",
      "sequence": 1,
      "pair_id": "pair-01",
      "arm": "all-max-control",
      "family": "feature",
      "size_risk_band": "medium",
      "acceptance_check_ids": ["functional-acceptance", "regression-suite", "defect-review", "latency-observation", "workflow-usage-attribution"]
    },
    {
      "slot_id": "m4-02",
      "sequence": 2,
      "pair_id": "pair-01",
      "arm": "dynamic-v0.2.1",
      "family": "feature",
      "size_risk_band": "medium",
      "acceptance_check_ids": ["functional-acceptance", "regression-suite", "defect-review", "latency-observation", "workflow-usage-attribution"]
    },
    {
      "slot_id": "m4-03",
      "sequence": 3,
      "pair_id": "pair-02",
      "arm": "dynamic-v0.2.1",
      "family": "bugfix",
      "size_risk_band": "medium",
      "acceptance_check_ids": ["functional-acceptance", "regression-suite", "defect-review", "latency-observation", "workflow-usage-attribution"]
    },
    {
      "slot_id": "m4-04",
      "sequence": 4,
      "pair_id": "pair-02",
      "arm": "all-max-control",
      "family": "bugfix",
      "size_risk_band": "medium",
      "acceptance_check_ids": ["functional-acceptance", "regression-suite", "defect-review", "latency-observation", "workflow-usage-attribution"]
    },
    {
      "slot_id": "m4-05",
      "sequence": 5,
      "pair_id": "pair-03",
      "arm": "all-max-control",
      "family": "integration",
      "size_risk_band": "large",
      "acceptance_check_ids": ["functional-acceptance", "regression-suite", "defect-review", "latency-observation", "workflow-usage-attribution"]
    },
    {
      "slot_id": "m4-06",
      "sequence": 6,
      "pair_id": "pair-03",
      "arm": "dynamic-v0.2.1",
      "family": "integration",
      "size_risk_band": "large",
      "acceptance_check_ids": ["functional-acceptance", "regression-suite", "defect-review", "latency-observation", "workflow-usage-attribution"]
    },
    {
      "slot_id": "m4-07",
      "sequence": 7,
      "pair_id": "pair-04",
      "arm": "dynamic-v0.2.1",
      "family": "security",
      "size_risk_band": "high-risk",
      "acceptance_check_ids": ["functional-acceptance", "regression-suite", "defect-review", "latency-observation", "workflow-usage-attribution"]
    },
    {
      "slot_id": "m4-08",
      "sequence": 8,
      "pair_id": "pair-04",
      "arm": "all-max-control",
      "family": "security",
      "size_risk_band": "high-risk",
      "acceptance_check_ids": ["functional-acceptance", "regression-suite", "defect-review", "latency-observation", "workflow-usage-attribution"]
    },
    {
      "slot_id": "m4-09",
      "sequence": 9,
      "pair_id": "pair-05",
      "arm": "all-max-control",
      "family": "routing",
      "size_risk_band": "medium",
      "acceptance_check_ids": ["functional-acceptance", "regression-suite", "defect-review", "latency-observation", "workflow-usage-attribution"]
    },
    {
      "slot_id": "m4-10",
      "sequence": 10,
      "pair_id": "pair-05",
      "arm": "dynamic-v0.2.1",
      "family": "routing",
      "size_risk_band": "medium",
      "acceptance_check_ids": ["functional-acceptance", "regression-suite", "defect-review", "latency-observation", "workflow-usage-attribution"]
    }
  ],
  "origin": "unsigned-local-audit"
}
